{
  "branding": {
    "name": "Softleader Nuxt Framework",
    "shortName": "SL Nuxt",
    "logo": "/images/logo.png",
    "icon": "/favicon.ico",
    "copyright": "© 2026 Softleader Technical Team. All rights reserved."
  },
  "meta": {
    "title": "Nuxt Core Framework",
    "description": "Enterprise-grade Nuxt 3 core layer with atomic components.",
    "author": "Softleader Team",
    "lang": "zh-TW"
  },
  "layout": {
    "menuStyle": "sidebar",
    "sidebar": {
      "width": 260,
      "title": "System Control"
    },
    "header": {
      "fixed": true,
      "search": true,
      "searchPlaceholder": "Search..."
    }
  },
  "theme": {
    "primaryColor": "#2563eb",
    "borderRadius": 12,
    "animation": true
  },
  "network": {
    "apiBaseUrl": "/api/v1",
    "proxy": {}
  },
  "features": {
    "enableWatermark": false,
    "enableAuth": true,
    "enableLog": true
  }
}
